judul,category_1,category_2,the_category
Penetrasi Teknologi Informasi dalam Praktik Keagamaan,Agama dan Kepercayaan,Teknologi Informasi dan Komunikasi,Agama dan Kepercayaan & Teknologi Informasi dan Komunikasi
Persepsi Masyarakat Terhadap Penggunaan Media Sosial dalam Konteks Agama,Agama dan Kepercayaan,Teknologi Informasi dan Komunikasi,Agama dan Kepercayaan & Teknologi Informasi dan Komunikasi
Survei Tentang Peran Aplikasi dan Platform Digital dalam Pelaksanaan Ibadah,Agama dan Kepercayaan,Teknologi Informasi dan Komunikasi,Agama dan Kepercayaan & Teknologi Informasi dan Komunikasi
Analisis Pengaruh Teknologi Informasi dan Komunikasi dalam Penyebaran Nilai-nilai Keagamaan,Agama dan Kepercayaan,Teknologi Informasi dan Komunikasi,Agama dan Kepercayaan & Teknologi Informasi dan Komunikasi
Penilaian Terhadap Etika Penggunaan Teknologi oleh Pemuka Agama dan Umatnya,Agama dan Kepercayaan,Teknologi Informasi dan Komunikasi,Agama dan Kepercayaan & Teknologi Informasi dan Komunikasi
Survei Tentang Peran Agama dalam Olahraga dan Rekreasi Masyarakat,Agama dan Kepercayaan,Olahraga dan Rekreasi,Agama dan Kepercayaan & Olahraga dan Rekreasi
Analisis Dampak Kegiatan Olahraga Terhadap Spiritualitas dan Kepercayaan Agama,Agama dan Kepercayaan,Olahraga dan Rekreasi,Agama dan Kepercayaan & Olahraga dan Rekreasi
Penilaian Terhadap Praktik Olahraga Berbasis Agama dalam Komunitas,Agama dan Kepercayaan,Olahraga dan Rekreasi,Agama dan Kepercayaan & Olahraga dan Rekreasi
Persepsi Masyarakat Terhadap Keberagaman Agama dalam Kegiatan Rekreasi,Agama dan Kepercayaan,Olahraga dan Rekreasi,Agama dan Kepercayaan & Olahraga dan Rekreasi
Studi Tentang Peran Agama dalam Pengembangan dan Promosi Wisata Spiritual Olahraga,Agama dan Kepercayaan,Olahraga dan Rekreasi,Agama dan Kepercayaan & Olahraga dan Rekreasi
Survei Tentang Ekspresi Keagamaan dalam Seni dan Budaya,Agama dan Kepercayaan,Seni dan Budaya,Agama dan Kepercayaan & Seni dan Budaya
Analisis Dampak Kepercayaan Agama dalam Perkembangan Seni Rupa,Agama dan Kepercayaan,Seni dan Budaya,Agama dan Kepercayaan & Seni dan Budaya
Penilaian Terhadap Peran Lembaga Keagamaan dalam Pelestarian Warisan Budaya,Agama dan Kepercayaan,Seni dan Budaya,Agama dan Kepercayaan & Seni dan Budaya
Studi Tentang Perspektif Keagamaan dalam Seni Pertunjukan,Agama dan Kepercayaan,Seni dan Budaya,Agama dan Kepercayaan & Seni dan Budaya
Persepsi Masyarakat Terhadap Integritas Budaya dan Nilai-nilai Agama,Agama dan Kepercayaan,Seni dan Budaya,Agama dan Kepercayaan & Seni dan Budaya
Survei Mengenai Multikepercayaan dan Toleransi Agama,Agama dan Kepercayaan,Agama dan Kepercayaan,Agama dan Kepercayaan & Agama dan Kepercayaan
Analisis Perbedaan Keyakinan dan Praktik dalam Berbagai Agama,Agama dan Kepercayaan,Agama dan Kepercayaan,Agama dan Kepercayaan & Agama dan Kepercayaan
Penilaian Terhadap Peran Interfaith dalam Pembangunan Harmoni dan Persatuan,Agama dan Kepercayaan,Agama dan Kepercayaan,Agama dan Kepercayaan & Agama dan Kepercayaan
Studi Tentang Perbandingan Ajaran Agama dalam Konteks Moralitas dan Etika,Agama dan Kepercayaan,Agama dan Kepercayaan,Agama dan Kepercayaan & Agama dan Kepercayaan
Persepsi Umat Terhadap Transformasi Agama dan Kepercayaan di Era Modern,Agama dan Kepercayaan,Agama dan Kepercayaan,Agama dan Kepercayaan & Agama dan Kepercayaan
Survei Tentang Etika Bisnis Berbasis Agama,Agama dan Kepercayaan,Bisnis dan Industri,Agama dan Kepercayaan & Bisnis dan Industri
Analisis Pengaruh Kepercayaan Agama dalam Pengambilan Keputusan Bisnis,Agama dan Kepercayaan,Bisnis dan Industri,Agama dan Kepercayaan & Bisnis dan Industri
Penilaian Terhadap Peran Agama dalam Tanggung Jawab Sosial Perusahaan,Agama dan Kepercayaan,Bisnis dan Industri,Agama dan Kepercayaan & Bisnis dan Industri
Studi Tentang Pengembangan Bisnis Berbasis Agama dan Kepercayaan,Agama dan Kepercayaan,Bisnis dan Industri,Agama dan Kepercayaan & Bisnis dan Industri
Persepsi Masyarakat Terhadap Integrasi Agama dalam Dunia Bisnis,Agama dan Kepercayaan,Bisnis dan Industri,Agama dan Kepercayaan & Bisnis dan Industri
Survei Tentang Peran Pemuka Agama dalam Politik dan Pemerintahan,Agama dan Kepercayaan,Politik dan Pemerintahan,Agama dan Kepercayaan & Politik dan Pemerintahan
Analisis Pengaruh Keyakinan Agama dalam Partisipasi Politik Masyarakat,Agama dan Kepercayaan,Politik dan Pemerintahan,Agama dan Kepercayaan & Politik dan Pemerintahan
Penilaian Terhadap Kontribusi Agama dalam Pembentukan Kebijakan Publik,Agama dan Kepercayaan,Politik dan Pemerintahan,Agama dan Kepercayaan & Politik dan Pemerintahan
Studi Tentang Hubungan Antara Agama dan Kekuasaan Politik,Agama dan Kepercayaan,Politik dan Pemerintahan,Agama dan Kepercayaan & Politik dan Pemerintahan
Persepsi Masyarakat Terhadap Pemisahan Agama dan Negara,Agama dan Kepercayaan,Politik dan Pemerintahan,Agama dan Kepercayaan & Politik dan Pemerintahan
Survei Tentang Praktik Keagamaan dalam Perjalanan dan Transportasi,Agama dan Kepercayaan,Transportasi dan Logistik,Agama dan Kepercayaan & Transportasi dan Logistik
Analisis Dampak Keyakinan Agama dalam Logistik Kegiatan Keagamaan,Agama dan Kepercayaan,Transportasi dan Logistik,Agama dan Kepercayaan & Transportasi dan Logistik
Penilaian Terhadap Peran Agama dalam Layanan Transportasi Publik,Agama dan Kepercayaan,Transportasi dan Logistik,Agama dan Kepercayaan & Transportasi dan Logistik
Studi Tentang Pengaruh Agama dalam Pengaturan Perjalanan Ibadah,Agama dan Kepercayaan,Transportasi dan Logistik,Agama dan Kepercayaan & Transportasi dan Logistik
Persepsi Masyarakat Terhadap Infrastruktur Religius dalam Transportasi Umum,Agama dan Kepercayaan,Transportasi dan Logistik,Agama dan Kepercayaan & Transportasi dan Logistik
Survei Tentang Praktik Keagamaan dalam Pertanian dan Perikanan,Agama dan Kepercayaan,Pertanian dan Perikanan,Agama dan Kepercayaan & Pertanian dan Perikanan
Analisis Dampak Keyakinan Agama dalam Pengelolaan Sumber Daya Alam Pertanian,Agama dan Kepercayaan,Pertanian dan Perikanan,Agama dan Kepercayaan & Pertanian dan Perikanan
Penilaian Terhadap Peran Agama dalam Etika Pangan dan Kehidupan Berkelanjutan,Agama dan Kepercayaan,Pertanian dan Perikanan,Agama dan Kepercayaan & Pertanian dan Perikanan
Studi Tentang Tradisi Keagamaan dalam Kalender Pertanian dan Perikanan,Agama dan Kepercayaan,Pertanian dan Perikanan,Agama dan Kepercayaan & Pertanian dan Perikanan
Persepsi Masyarakat Terhadap Peranan Pemuka Agama dalam Pertanian dan Perikanan,Agama dan Kepercayaan,Pertanian dan Perikanan,Agama dan Kepercayaan & Pertanian dan Perikanan
Survei Kepuasan Pasien terhadap Pelayanan Kesehatan dari Industri Swasta,Bisnis dan Industri,Kesehatan,Bisnis dan Industri & Kesehatan
Analisis Dampak Industri Farmasi terhadap Aksesibilitas dan Affordabilitas Obat,Bisnis dan Industri,Kesehatan,Bisnis dan Industri & Kesehatan
Penilaian Terhadap Peran Perusahaan dalam Mendorong Gaya Hidup Sehat di Tempat Kerja,Bisnis dan Industri,Kesehatan,Bisnis dan Industri & Kesehatan
Studi Tentang Inovasi Teknologi dalam Industri Kesehatan dan Pengaruhnya terhadap Pasien,Bisnis dan Industri,Kesehatan,Bisnis dan Industri & Kesehatan
Persepsi Masyarakat terhadap Keterlibatan Industri dalam Program Kesehatan Masyarakat,Bisnis dan Industri,Kesehatan,Bisnis dan Industri & Kesehatan
Survei Kualitas Pelatihan dan Pengembangan Karyawan oleh Industri Pendidikan,Bisnis dan Industri,Pendidikan,Bisnis dan Industri & Pendidikan
Analisis Dampak Industri Pendidikan terhadap Kesetaraan Akses Pendidikan,Bisnis dan Industri,Pendidikan,Bisnis dan Industri & Pendidikan
Penilaian Terhadap Keterlibatan Industri dalam Pengembangan Kurikulum Pendidikan,Bisnis dan Industri,Pendidikan,Bisnis dan Industri & Pendidikan
Studi Tentang Peran Sektor Bisnis dalam Membangun Keterampilan Kerja di Pendidikan Tinggi,Bisnis dan Industri,Pendidikan,Bisnis dan Industri & Pendidikan
Persepsi Masyarakat terhadap Kemitraan Industri dan Pendidikan dalam Persiapan Karier,Bisnis dan Industri,Pendidikan,Bisnis dan Industri & Pendidikan
Survei Tentang Efektivitas Sistem Hukum dalam Menangani Perselisihan Bisnis,Bisnis dan Industri,Hukum,Bisnis dan Industri & Hukum
Analisis Dampak Kepatuhan Hukum dalam Pengembangan dan Pertumbuhan Bisnis,Bisnis dan Industri,Hukum,Bisnis dan Industri & Hukum
Penilaian Terhadap Peran Industri Hukum dalam Mendukung Keadilan dan Kepatuhan,Bisnis dan Industri,Hukum,Bisnis dan Industri & Hukum
Studi Tentang Persepsi Masyarakat terhadap Etika Bisnis dalam Konteks Hukum,Bisnis dan Industri,Hukum,Bisnis dan Industri & Hukum
Persepsi Pelaku Bisnis terhadap Peraturan dan Regulasi Hukum yang Berlaku,Bisnis dan Industri,Hukum,Bisnis dan Industri & Hukum
Survei Kepuasan Nasabah terhadap Layanan Keuangan dari Industri Swasta,Bisnis dan Industri,Keuangan,Bisnis dan Industri & Keuangan
Analisis Dampak Industri FinTech terhadap Inklusi Keuangan dan Akses Perbankan,Bisnis dan Industri,Keuangan,Bisnis dan Industri & Keuangan
Penilaian Terhadap Peran Industri Keuangan dalam Pembangunan Ekonomi Lokal,Bisnis dan Industri,Keuangan,Bisnis dan Industri & Keuangan
Studi Tentang Tren Inovasi Keuangan dalam Dunia Bisnis dan Perubahan Perilaku Konsumen,Bisnis dan Industri,Keuangan,Bisnis dan Industri & Keuangan
Persepsi Masyarakat terhadap Tanggung Jawab Sosial dan Etika Bisnis dalam Industri Keuangan,Bisnis dan Industri,Keuangan,Bisnis dan Industri & Keuangan
Survei Kepuasan Wisatawan terhadap Layanan dan Fasilitas Industri Pariwisata,Bisnis dan Industri,Pariwisata,Bisnis dan Industri & Pariwisata
Analisis Dampak Industri Pariwisata terhadap Pembangunan Ekonomi dan Penghidupan Lokal,Bisnis dan Industri,Pariwisata,Bisnis dan Industri & Pariwisata
Penilaian Terhadap Peran Industri dalam Pelestarian Budaya dan Warisan di Destinasi Pariwisata,Bisnis dan Industri,Pariwisata,Bisnis dan Industri & Pariwisata
Studi Tentang Persepsi Masyarakat terhadap Dampak Sosial dan Lingkungan dari Industri Pariwisata,Bisnis dan Industri,Pariwisata,Bisnis dan Industri & Pariwisata
Persepsi Pelaku Industri terhadap Tantangan dan Peluang dalam Menghadapi Perubahan Permintaan Pariwisata,Bisnis dan Industri,Pariwisata,Bisnis dan Industri & Pariwisata
Survei Tanggapan Masyarakat terhadap Program Tanggung Jawab Sosial Perusahaan (CSR),Bisnis dan Industri,Sosial dan Kemanusiaan,Bisnis dan Industri & Sosial dan Kemanusiaan
Analisis Dampak Industri dalam Meningkatkan Kualitas Hidup dan Kesejahteraan Masyarakat,Bisnis dan Industri,Sosial dan Kemanusiaan,Bisnis dan Industri & Sosial dan Kemanusiaan
Penilaian Terhadap Peran Bisnis dalam Mengatasi Masalah Sosial dan Kemanusiaan,Bisnis dan Industri,Sosial dan Kemanusiaan,Bisnis dan Industri & Sosial dan Kemanusiaan
Studi Tentang Inovasi Bisnis dalam Menyelesaikan Tantangan Sosial dan Kemanusiaan,Bisnis dan Industri,Sosial dan Kemanusiaan,Bisnis dan Industri & Sosial dan Kemanusiaan
Persepsi Masyarakat terhadap Keberlanjutan dan Keberagaman dalam Dunia Bisnis,Bisnis dan Industri,Sosial dan Kemanusiaan,Bisnis dan Industri & Sosial dan Kemanusiaan
Survei Kebijakan Lingkungan dan Praktik Berkelanjutan dalam Industri,Bisnis dan Industri,Lingkungan dan Konservasi,Bisnis dan Industri & Lingkungan dan Konservasi
Analisis Dampak Industri terhadap Pemanasan Global dan Perubahan Iklim,Bisnis dan Industri,Lingkungan dan Konservasi,Bisnis dan Industri & Lingkungan dan Konservasi
Penilaian Terhadap Peran Bisnis dalam Konservasi Sumber Daya Alam dan Lingkungan,Bisnis dan Industri,Lingkungan dan Konservasi,Bisnis dan Industri & Lingkungan dan Konservasi
Studi Tentang Strategi Bisnis Ramah Lingkungan dan Persepsi Konsumen,Bisnis dan Industri,Lingkungan dan Konservasi,Bisnis dan Industri & Lingkungan dan Konservasi
Persepsi Masyarakat terhadap Etika dan Tanggung Jawab Lingkungan dalam Bisnis,Bisnis dan Industri,Lingkungan dan Konservasi,Bisnis dan Industri & Lingkungan dan Konservasi
Survei Kepuasan Pengguna terhadap Layanan dan Produk Teknologi Informasi dan Komunikasi,Bisnis dan Industri,Teknologi Informasi dan Komunikasi,Bisnis dan Industri & Teknologi Informasi dan Komunikasi
Analisis Dampak Inovasi Teknologi dalam Meningkatkan Efisiensi dan Produktivitas Bisnis,Bisnis dan Industri,Teknologi Informasi dan Komunikasi,Bisnis dan Industri & Teknologi Informasi dan Komunikasi
Penilaian Terhadap Peran Industri Teknologi dalam Mendorong Transformasi Digital di Organisasi,Bisnis dan Industri,Teknologi Informasi dan Komunikasi,Bisnis dan Industri & Teknologi Informasi dan Komunikasi
Studi Tentang Tantangan Keamanan dan Privasi dalam Penerapan Teknologi Bisnis,Bisnis dan Industri,Teknologi Informasi dan Komunikasi,Bisnis dan Industri & Teknologi Informasi dan Komunikasi
Persepsi Pelaku Bisnis terhadap Manfaat dan Tantangan Mengadopsi Teknologi Informasi dan Komunikasi,Bisnis dan Industri,Teknologi Informasi dan Komunikasi,Bisnis dan Industri & Teknologi Informasi dan Komunikasi
Survei Kepuasan Pengunjung terhadap Layanan dan Fasilitas Industri Olahraga dan Rekreasi,Bisnis dan Industri,Olahraga dan Rekreasi,Bisnis dan Industri & Olahraga dan Rekreasi
Analisis Dampak Industri Olahraga dalam Pariwisata dan Ekonomi Lokal,Bisnis dan Industri,Olahraga dan Rekreasi,Bisnis dan Industri & Olahraga dan Rekreasi
Penilaian Terhadap Peran Bisnis dalam Mendukung Gaya Hidup Aktif dan Kesehatan Masyarakat,Bisnis dan Industri,Olahraga dan Rekreasi,Bisnis dan Industri & Olahraga dan Rekreasi
Studi Tentang Inovasi Bisnis dalam Industri Hiburan Olahraga dan Rekreasi,Bisnis dan Industri,Olahraga dan Rekreasi,Bisnis dan Industri & Olahraga dan Rekreasi
Persepsi Masyarakat terhadap Etika dan Transparansi dalam Bisnis Olahraga dan Rekreasi,Bisnis dan Industri,Olahraga dan Rekreasi,Bisnis dan Industri & Olahraga dan Rekreasi
Survei Kepuasan Pengunjung terhadap Layanan dan Pengalaman dalam Industri Seni dan Budaya,Bisnis dan Industri,Seni dan Budaya,Bisnis dan Industri & Seni dan Budaya
Analisis Dampak Industri Seni dan Budaya terhadap Pariwisata dan Identitas Lokal,Bisnis dan Industri,Seni dan Budaya,Bisnis dan Industri & Seni dan Budaya
Penilaian Terhadap Peran Bisnis dalam Mendukung Kreativitas dan Pengembangan Seni dan Budaya,Bisnis dan Industri,Seni dan Budaya,Bisnis dan Industri & Seni dan Budaya
Studi Tentang Kolaborasi antara Bisnis dan Dunia Seni dalam Mendorong Pertumbuhan Ekonomi Kreatif,Bisnis dan Industri,Seni dan Budaya,Bisnis dan Industri & Seni dan Budaya
Persepsi Masyarakat terhadap Keberlanjutan dan Pelestarian Seni dan Warisan Budaya oleh Industri,Bisnis dan Industri,Seni dan Budaya,Bisnis dan Industri & Seni dan Budaya
Survei tentang Persepsi dan Preferensi Konsumen dalam Produk dan Layanan Berbasis Agama,Bisnis dan Industri,Agama dan Kepercayaan,Bisnis dan Industri & Agama dan Kepercayaan
Analisis Dampak Industri pada Praktik Keagamaan dan Tradisi Kepercayaan,Bisnis dan Industri,Agama dan Kepercayaan,Bisnis dan Industri & Agama dan Kepercayaan
Penilaian Terhadap Peran Bisnis dalam Menjaga Etika dan Nilai-Nilai Keagamaan,Bisnis dan Industri,Agama dan Kepercayaan,Bisnis dan Industri & Agama dan Kepercayaan
Studi Tentang Penerimaan dan Tantangan dalam Menggabungkan Agama dengan Kegiatan Bisnis,Bisnis dan Industri,Agama dan Kepercayaan,Bisnis dan Industri & Agama dan Kepercayaan
Persepsi Masyarakat terhadap Keterlibatan Bisnis dalam Masyarakat Berbasis Agama,Bisnis dan Industri,Agama dan Kepercayaan,Bisnis dan Industri & Agama dan Kepercayaan
Survei Tentang Hubungan Antara Bisnis dan Kebijakan Pemerintah dalam Pembangunan Ekonomi,Bisnis dan Industri,Politik dan Pemerintahan,Bisnis dan Industri & Politik dan Pemerintahan
Analisis Dampak Industri pada Proses Politik dan Keputusan Kebijakan,Bisnis dan Industri,Politik dan Pemerintahan,Bisnis dan Industri & Politik dan Pemerintahan
Penilaian Terhadap Peran Bisnis dalam Membentuk dan Mendukung Kepemimpinan Politik,Bisnis dan Industri,Politik dan Pemerintahan,Bisnis dan Industri & Politik dan Pemerintahan
Studi Tentang Praktik Lobbying dan Pengaruh Industri dalam Proses Legislasi,Bisnis dan Industri,Politik dan Pemerintahan,Bisnis dan Industri & Politik dan Pemerintahan
Persepsi Masyarakat terhadap Etika Bisnis dan Transparansi dalam Hubungan dengan Politik dan Pemerintahan,Bisnis dan Industri,Politik dan Pemerintahan,Bisnis dan Industri & Politik dan Pemerintahan
Survei Kepuasan Pengguna terhadap Layanan Transportasi dan Logistik dari Industri Swasta,Bisnis dan Industri,Transportasi dan Logistik,Bisnis dan Industri & Transportasi dan Logistik
Analisis Dampak Industri pada Infrastruktur Transportasi dan Ketersediaan Logistik,Bisnis dan Industri,Transportasi dan Logistik,Bisnis dan Industri & Transportasi dan Logistik
Penilaian Terhadap Peran Bisnis dalam Inovasi Transportasi dan Efisiensi Logistik,Bisnis dan Industri,Transportasi dan Logistik,Bisnis dan Industri & Transportasi dan Logistik
Studi Tentang Tantangan dan Peluang dalam Mengadopsi Teknologi dalam Industri Transportasi dan Logistik,Bisnis dan Industri,Transportasi dan Logistik,Bisnis dan Industri & Transportasi dan Logistik
Persepsi Masyarakat terhadap Kebijakan dan Dampak Lingkungan dari Industri Transportasi dan Logistik,Bisnis dan Industri,Transportasi dan Logistik,Bisnis dan Industri & Transportasi dan Logistik
Survei Kepuasan Konsumen terhadap Produk Pertanian dan Perikanan dari Industri,Bisnis dan Industri,Pertanian dan Perikanan,Bisnis dan Industri & Pertanian dan Perikanan
Analisis Dampak Industri pada Keberlanjutan Pertanian dan Perikanan,Bisnis dan Industri,Pertanian dan Perikanan,Bisnis dan Industri & Pertanian dan Perikanan
Penilaian Terhadap Peran Bisnis dalam Pengembangan dan Pemasaran Produk Pertanian dan Perikanan,Bisnis dan Industri,Pertanian dan Perikanan,Bisnis dan Industri & Pertanian dan Perikanan
Studi Tentang Inovasi Bisnis dalam Meningkatkan Efisiensi dan Keberlanjutan Sektor Pertanian dan Perikanan,Bisnis dan Industri,Pertanian dan Perikanan,Bisnis dan Industri & Pertanian dan Perikanan
Persepsi Masyarakat terhadap Etika dan Tanggung Jawab Sosial Bisnis dalam Industri Pertanian dan Perikanan,Bisnis dan Industri,Pertanian dan Perikanan,Bisnis dan Industri & Pertanian dan Perikanan
Survei Kepuasan Masyarakat terhadap Kebijakan Kesehatan dan Pelayanan Publik,Politik dan Pemerintahan,Kesehatan,Politik dan Pemerintahan & Kesehatan
Analisis Dampak Kebijakan Politik pada Akses dan Kualitas Layanan Kesehatan,Politik dan Pemerintahan,Kesehatan,Politik dan Pemerintahan & Kesehatan
Penilaian Terhadap Peran Pemerintah dalam Mengatasi Tantangan Kesehatan Masyarakat,Politik dan Pemerintahan,Kesehatan,Politik dan Pemerintahan & Kesehatan
Studi Tentang Persepsi Masyarakat terhadap Kebijakan Vaksinasi dan Pengendalian Penyakit,Politik dan Pemerintahan,Kesehatan,Politik dan Pemerintahan & Kesehatan
Persepsi Stakeholder terhadap Kualitas Pelayanan Kesehatan dan Reformasi Sistem Kesehatan,Politik dan Pemerintahan,Kesehatan,Politik dan Pemerintahan & Kesehatan
Survei Kepuasan Masyarakat terhadap Kualitas Pendidikan dan Kebijakan Pendidikan,Politik dan Pemerintahan,Pendidikan,Politik dan Pemerintahan & Pendidikan
Analisis Dampak Kebijakan Pendidikan terhadap Akses dan Mutu Pendidikan,Politik dan Pemerintahan,Pendidikan,Politik dan Pemerintahan & Pendidikan
Penilaian Terhadap Peran Pemerintah dalam Meningkatkan Pendidikan Inklusif dan Merata,Politik dan Pemerintahan,Pendidikan,Politik dan Pemerintahan & Pendidikan
Studi Tentang Tantangan dan Inovasi dalam Pendidikan di Era Digital,Politik dan Pemerintahan,Pendidikan,Politik dan Pemerintahan & Pendidikan
Persepsi Masyarakat terhadap Pengelolaan dan Akuntabilitas Sektor Pendidikan,Politik dan Pemerintahan,Pendidikan,Politik dan Pemerintahan & Pendidikan
Survei Kepuasan Masyarakat terhadap Sistem Peradilan dan Pelayanan Hukum,Politik dan Pemerintahan,Hukum,Politik dan Pemerintahan & Hukum
Analisis Dampak Kebijakan Hukum terhadap Keadilan dan Perlindungan Hak Asasi Manusia,Politik dan Pemerintahan,Hukum,Politik dan Pemerintahan & Hukum
Penilaian Terhadap Peran Pemerintah dalam Penegakan Hukum dan Pencegahan Korupsi,Politik dan Pemerintahan,Hukum,Politik dan Pemerintahan & Hukum
Studi Tentang Tantangan dan Reformasi Sistem Peradilan dalam Mewujudkan Keadilan,Politik dan Pemerintahan,Hukum,Politik dan Pemerintahan & Hukum
Persepsi Masyarakat terhadap Transparansi dan Akuntabilitas Sistem Hukum,Politik dan Pemerintahan,Hukum,Politik dan Pemerintahan & Hukum
Survei Kepuasan Masyarakat terhadap Kebijakan Fiskal dan Moneter,Politik dan Pemerintahan,Keuangan,Politik dan Pemerintahan & Keuangan
Analisis Dampak Kebijakan Keuangan terhadap Pertumbuhan Ekonomi dan Ketimpangan Sosial,Politik dan Pemerintahan,Keuangan,Politik dan Pemerintahan & Keuangan
Penilaian Terhadap Peran Pemerintah dalam Mendorong Investasi dan Pembangunan Ekonomi,Politik dan Pemerintahan,Keuangan,Politik dan Pemerintahan & Keuangan
Studi Tentang Tantangan dan Inovasi dalam Pengelolaan Keuangan Publik,Politik dan Pemerintahan,Keuangan,Politik dan Pemerintahan & Keuangan
Persepsi Masyarakat terhadap Transparansi dan Akuntabilitas Pengelolaan Keuangan Negara,Politik dan Pemerintahan,Keuangan,Politik dan Pemerintahan & Keuangan
Survei Kepuasan Wisatawan terhadap Destinasi Pariwisata dan Pelayanan Publik,Politik dan Pemerintahan,Pariwisata,Politik dan Pemerintahan & Pariwisata
Analisis Dampak Kebijakan Pemerintah pada Pengembangan Industri Pariwisata dan Ekonomi Lokal,Politik dan Pemerintahan,Pariwisata,Politik dan Pemerintahan & Pariwisata
Penilaian Terhadap Peran Pemerintah dalam Pelestarian Budaya dan Alam untuk Pariwisata,Politik dan Pemerintahan,Pariwisata,Politik dan Pemerintahan & Pariwisata
Studi Tentang Tantangan dan Peluang dalam Pariwisata Berkelanjutan dan Ramah Lingkungan,Politik dan Pemerintahan,Pariwisata,Politik dan Pemerintahan & Pariwisata
Persepsi Masyarakat terhadap Manfaat dan Dampak Pariwisata bagi Masyarakat dan Lingkungan,Politik dan Pemerintahan,Pariwisata,Politik dan Pemerintahan & Pariwisata
Survei Kepuasan Masyarakat terhadap Program Kesejahteraan Sosial dan Bantuan Publik,Politik dan Pemerintahan,Sosial dan Kemanusiaan,Politik dan Pemerintahan & Sosial dan Kemanusiaan
Analisis Dampak Kebijakan Sosial terhadap Pengentasan Kemiskinan dan Perlindungan Sosial,Politik dan Pemerintahan,Sosial dan Kemanusiaan,Politik dan Pemerintahan & Sosial dan Kemanusiaan
Penilaian Terhadap Peran Pemerintah dalam Mempromosikan Kesetaraan Gender dan Perlindungan Anak,Politik dan Pemerintahan,Sosial dan Kemanusiaan,Politik dan Pemerintahan & Sosial dan Kemanusiaan
Studi Tentang Tantangan dan Inovasi dalam Penanganan Bencana dan Krisis Kemanusiaan,Politik dan Pemerintahan,Sosial dan Kemanusiaan,Politik dan Pemerintahan & Sosial dan Kemanusiaan
Persepsi Masyarakat terhadap Partisipasi Sosial dan Kegiatan Sosial di Masyarakat,Politik dan Pemerintahan,Sosial dan Kemanusiaan,Politik dan Pemerintahan & Sosial dan Kemanusiaan
Survei Kepuasan Masyarakat terhadap Kebijakan Lingkungan dan Keberlanjutan,Politik dan Pemerintahan,Lingkungan dan Konservasi,Politik dan Pemerintahan & Lingkungan dan Konservasi
Analisis Dampak Kebijakan Pemerintah terhadap Pelestarian Sumber Daya Alam dan Ekosistem,Politik dan Pemerintahan,Lingkungan dan Konservasi,Politik dan Pemerintahan & Lingkungan dan Konservasi
Penilaian Terhadap Peran Pemerintah dalam Pengendalian Pencemaran dan Perubahan Iklim,Politik dan Pemerintahan,Lingkungan dan Konservasi,Politik dan Pemerintahan & Lingkungan dan Konservasi
Studi Tentang Tantangan dan Inovasi dalam Pengelolaan Limbah dan Pengembangan Energi Terbarukan,Politik dan Pemerintahan,Lingkungan dan Konservasi,Politik dan Pemerintahan & Lingkungan dan Konservasi
Persepsi Masyarakat terhadap Pembangunan Berkelanjutan dan Perlindungan Lingkungan,Politik dan Pemerintahan,Lingkungan dan Konservasi,Politik dan Pemerintahan & Lingkungan dan Konservasi
Survei Kepuasan Masyarakat terhadap Akses dan Penggunaan Teknologi Informasi,Politik dan Pemerintahan,Teknologi Informasi dan Komunikasi,Politik dan Pemerintahan & Teknologi Informasi dan Komunikasi
Analisis Dampak Kebijakan Pemerintah terhadap Pengembangan Infrastruktur Digital dan E-Government,Politik dan Pemerintahan,Teknologi Informasi dan Komunikasi,Politik dan Pemerintahan & Teknologi Informasi dan Komunikasi
Penilaian Terhadap Peran Pemerintah dalam Perlindungan Data Pribadi dan Keamanan Cyber,Politik dan Pemerintahan,Teknologi Informasi dan Komunikasi,Politik dan Pemerintahan & Teknologi Informasi dan Komunikasi
Studi Tentang Tantangan dan Potensi Inovasi Teknologi dalam Pelayanan Publik dan Partisipasi Politik,Politik dan Pemerintahan,Teknologi Informasi dan Komunikasi,Politik dan Pemerintahan & Teknologi Informasi dan Komunikasi
Persepsi Masyarakat terhadap Peran Media Sosial dan Pengaruhnya dalam Proses Demokrasi,Politik dan Pemerintahan,Teknologi Informasi dan Komunikasi,Politik dan Pemerintahan & Teknologi Informasi dan Komunikasi
Survei Kepuasan Masyarakat terhadap Kebijakan Olahraga dan Sarana Rekreasi,Politik dan Pemerintahan,Olahraga dan Rekreasi,Politik dan Pemerintahan & Olahraga dan Rekreasi
Analisis Dampak Kebijakan Pemerintah terhadap Pengembangan Industri Olahraga dan Pariwisata Olahraga,Politik dan Pemerintahan,Olahraga dan Rekreasi,Politik dan Pemerintahan & Olahraga dan Rekreasi
Penilaian Terhadap Peran Pemerintah dalam Peningkatan Partisipasi Masyarakat dalam Kegiatan Olahraga,Politik dan Pemerintahan,Olahraga dan Rekreasi,Politik dan Pemerintahan & Olahraga dan Rekreasi
Studi Tentang Tantangan dan Peluang dalam Pembangunan Infrastruktur dan Sarana Olahraga,Politik dan Pemerintahan,Olahraga dan Rekreasi,Politik dan Pemerintahan & Olahraga dan Rekreasi
Persepsi Masyarakat terhadap Peran Olahraga dalam Pemersatu Bangsa dan Meningkatkan Kualitas Hidup,Politik dan Pemerintahan,Olahraga dan Rekreasi,Politik dan Pemerintahan & Olahraga dan Rekreasi
