judul,category_1,category_2,the_category
Persepsi Masyarakat terhadap Perlindungan Hukum terhadap Konsumen dalam Transaksi Keuangan,Keuangan,Hukum,Keuangan & Hukum
Evaluasi Peran Hukum dalam Menjamin Keadilan dan Keamanan dalam Transaksi dan Investasi Keuangan,Keuangan,Hukum,Keuangan & Hukum
Tinjauan terhadap Regulasi Hukum dalam Mengatasi Praktik Keuangan yang Merugikan Konsumen,Keuangan,Hukum,Keuangan & Hukum
Penilaian Kepatuhan dan Penegakan Hukum terhadap Pelaku Kejahatan Keuangan,Keuangan,Hukum,Keuangan & Hukum
Penilaian Tingkat Literasi Keuangan di Kalangan Masyarakat,Keuangan,Keuangan,Keuangan & Keuangan
Evaluasi Persepsi dan Pengelolaan Risiko Keuangan Individu,Keuangan,Keuangan,Keuangan & Keuangan
Tinjauan Mengenai Pengaruh Faktor Keuangan Terhadap Keputusan Investasi,Keuangan,Keuangan,Keuangan & Keuangan
Penilaian Efektivitas Program Pendidikan Keuangan dalam Meningkatkan Pengetahuan dan Keterampilan Keuangan,Keuangan,Keuangan,Keuangan & Keuangan
Evaluasi Pengaruh Pariwisata terhadap Kondisi Keuangan Lokal,Keuangan,Pariwisata,Keuangan & Pariwisata
Tinjauan terhadap Preferensi Pengeluaran Wisatawan dan Dampaknya terhadap Ekonomi Lokal,Keuangan,Pariwisata,Keuangan & Pariwisata
Persepsi dan Sikap Masyarakat terhadap Dampak Keuangan Industri Pariwisata terhadap Kesejahteraan Masyarakat Lokal,Keuangan,Pariwisata,Keuangan & Pariwisata
Evaluasi Keefektifan Kebijakan Pajak dan Regulasi Keuangan dalam Mendukung Pertumbuhan Industri Pariwisata,Keuangan,Pariwisata,Keuangan & Pariwisata
Penilaian Persepsi dan Kepuasan Wisatawan terhadap Transaksi Keuangan di Destinasi Pariwisata,Keuangan,Pariwisata,Keuangan & Pariwisata
Tinjauan Mengenai Potensi Investasi dan Peluang Bisnis di Sektor Pariwisata untuk Pengembangan Keuangan Lokal,Keuangan,Pariwisata,Keuangan & Pariwisata
Analisis Dampak Perubahan Mata Uang terhadap Pariwisata dan Implikasinya terhadap Keuangan Destinasi,Keuangan,Pariwisata,Keuangan & Pariwisata
Persepsi Masyarakat tentang Hubungan Antara Kesejahteraan Finansial dan Kesejahteraan Sosial,Keuangan,Sosial dan Kemanusiaan,Keuangan & Sosial dan Kemanusiaan
Evaluasi Dampak Program Keuangan terhadap Pengentasan Kemiskinan dan Ketimpangan Sosial,Keuangan,Sosial dan Kemanusiaan,Keuangan & Sosial dan Kemanusiaan
Penilaian Efektivitas Program Bantuan Keuangan dalam Meningkatkan Kemandirian Sosial dan Kesejahteraan Masyarakat,Keuangan,Sosial dan Kemanusiaan,Keuangan & Sosial dan Kemanusiaan
Tinjauan terhadap Peran Keuangan dalam Mendukung Program Sosial dan Kemanusiaan,Keuangan,Sosial dan Kemanusiaan,Keuangan & Sosial dan Kemanusiaan
Analisis Dampak Faktor Ekonomi dan Keuangan terhadap Masalah Sosial dan Kemanusiaan dalam Masyarakat,Keuangan,Sosial dan Kemanusiaan,Keuangan & Sosial dan Kemanusiaan
Penilaian Persepsi dan Sikap Masyarakat terhadap Investasi Keuangan yang Berkelanjutan dan Ramah Lingkungan,Keuangan,Lingkungan dan Konservasi,Keuangan & Lingkungan dan Konservasi
Evaluasi Dampak Ekonomi dan Keuangan dari Kegiatan Konservasi Lingkungan,Keuangan,Lingkungan dan Konservasi,Keuangan & Lingkungan dan Konservasi
Tinjauan Mengenai Peran Keuangan dalam Mendukung Proyek Konservasi dan Keberlanjutan Lingkungan,Keuangan,Lingkungan dan Konservasi,Keuangan & Lingkungan dan Konservasi
Analisis Persepsi dan Preferensi Masyarakat terhadap Produk dan Layanan Keuangan yang Bertanggung Jawab Lingkungan,Keuangan,Lingkungan dan Konservasi,Keuangan & Lingkungan dan Konservasi
Penilaian Penerimaan dan Penggunaan Teknologi Keuangan oleh Masyarakat,Keuangan,Teknologi Informasi dan Komunikasi,Keuangan & Teknologi Informasi dan Komunikasi
Evaluasi Keamanan dan Perlindungan Data dalam Transaksi Keuangan Digital,Keuangan,Teknologi Informasi dan Komunikasi,Keuangan & Teknologi Informasi dan Komunikasi
Tinjauan terhadap Pengaruh Teknologi Informasi dan Komunikasi dalam Meningkatkan Aksesibilitas Layanan Keuangan,Keuangan,Teknologi Informasi dan Komunikasi,Keuangan & Teknologi Informasi dan Komunikasi
Persepsi Masyarakat terhadap Inovasi Finansial berbasis Teknologi,Keuangan,Teknologi Informasi dan Komunikasi,Keuangan & Teknologi Informasi dan Komunikasi
Analisis Dampak Teknologi Keuangan terhadap Perilaku dan Pengelolaan Keuangan Individu,Keuangan,Teknologi Informasi dan Komunikasi,Keuangan & Teknologi Informasi dan Komunikasi
Persepsi dan Kebiasaan Pengeluaran Keuangan dalam Aktivitas Olahraga dan Rekreasi,Keuangan,Olahraga dan Rekreasi,Keuangan & Olahraga dan Rekreasi
Evaluasi Dampak Ekonomi Industri Olahraga dan Rekreasi terhadap Keuangan Masyarakat,Keuangan,Olahraga dan Rekreasi,Keuangan & Olahraga dan Rekreasi
Tinjauan terhadap Pengelolaan Keuangan dalam Partisipasi dalam Kegiatan Olahraga dan Rekreasi,Keuangan,Olahraga dan Rekreasi,Keuangan & Olahraga dan Rekreasi
Penilaian Efektivitas Program Keuangan dalam Mendorong Partisipasi Olahraga dan Rekreasi yang Terjangkau,Keuangan,Olahraga dan Rekreasi,Keuangan & Olahraga dan Rekreasi
Analisis Faktor Ekonomi yang Mempengaruhi Keterlibatan dan Investasi Keuangan dalam Olahraga dan Rekreasi,Keuangan,Olahraga dan Rekreasi,Keuangan & Olahraga dan Rekreasi
Evaluasi Dampak Sponsorship dan Investasi Keuangan pada Olahraga dan Rekreasi,Keuangan,Olahraga dan Rekreasi,Keuangan & Olahraga dan Rekreasi
Tinjauan terhadap Preferensi Konsumen dan Perilaku Pembelian terkait dengan Olahraga dan Rekreasi,Keuangan,Olahraga dan Rekreasi,Keuangan & Olahraga dan Rekreasi
Persepsi dan Partisipasi Masyarakat dalam Pengelolaan Keuangan untuk Dukungan Seni dan Budaya,Keuangan,Seni dan Budaya,Keuangan & Seni dan Budaya
Evaluasi Dampak Program Keuangan dalam Mendukung Pengembangan Industri Seni dan Budaya,Keuangan,Seni dan Budaya,Keuangan & Seni dan Budaya
Tinjauan terhadap Preferensi dan Kebiasaan Pengeluaran Keuangan dalam Aktivitas Seni dan Budaya,Keuangan,Seni dan Budaya,Keuangan & Seni dan Budaya
Analisis Peran Investasi Keuangan dalam Mempromosikan Kreativitas dan Inovasi di Industri Seni dan Budaya,Keuangan,Seni dan Budaya,Keuangan & Seni dan Budaya
Penilaian Efektivitas Sistem Keuangan dalam Menjamin Keberlanjutan Sektor Seni dan Budaya,Keuangan,Seni dan Budaya,Keuangan & Seni dan Budaya
Persepsi dan Praktik Keuangan dalam Konteks Agama dan Kepercayaan,Keuangan,Agama dan Kepercayaan,Keuangan & Agama dan Kepercayaan
Evaluasi Dampak Keuangan terhadap Praktik Keagamaan dan Spiritualitas,Keuangan,Agama dan Kepercayaan,Keuangan & Agama dan Kepercayaan
Tinjauan Mengenai Konsep Pengelolaan Keuangan dalam Ajaran Agama dan Kepercayaan,Keuangan,Agama dan Kepercayaan,Keuangan & Agama dan Kepercayaan
Analisis Persepsi Masyarakat tentang Keterkaitan Antara Keuangan dan Kehidupan Spiritual,Keuangan,Agama dan Kepercayaan,Keuangan & Agama dan Kepercayaan
Penilaian Peran Keuangan dalam Mendukung Praktik Filantropi dan Amal dalam Agama dan Kepercayaan,Keuangan,Agama dan Kepercayaan,Keuangan & Agama dan Kepercayaan
Penilaian Pengetahuan dan Keterampilan Keuangan dalam Bisnis dan Industri,Keuangan,Bisnis dan Industri,Keuangan & Bisnis dan Industri
Evaluasi Kebutuhan dan Tantangan Keuangan dalam Mengelola Bisnis dan Industri,Keuangan,Bisnis dan Industri,Keuangan & Bisnis dan Industri
Tinjauan Mengenai Strategi Pengelolaan Keuangan yang Efektif di Industri dan Bisnis,Keuangan,Bisnis dan Industri,Keuangan & Bisnis dan Industri
Analisis Dampak Keputusan Keuangan terhadap Kinerja Bisnis dan Industri,Keuangan,Bisnis dan Industri,Keuangan & Bisnis dan Industri
Persepsi dan Preferensi Masyarakat terhadap Layanan Keuangan dalam Konteks Bisnis dan Industri,Keuangan,Bisnis dan Industri,Keuangan & Bisnis dan Industri
Evaluasi Risiko dan Peluang Keuangan dalam Pengembangan Bisnis dan Industri,Keuangan,Bisnis dan Industri,Keuangan & Bisnis dan Industri
Tinjauan terhadap Inovasi Keuangan dalam Mendorong Pertumbuhan dan Keberlanjutan Bisnis dan Industri,Keuangan,Bisnis dan Industri,Keuangan & Bisnis dan Industri
Evaluasi Transparansi dan Akuntabilitas Keuangan dalam Politik dan Pemerintahan,Keuangan,Politik dan Pemerintahan,Keuangan & Politik dan Pemerintahan
Tinjauan terhadap Pengelolaan Keuangan Publik dalam Konteks Politik dan Pemerintahan,Keuangan,Politik dan Pemerintahan,Keuangan & Politik dan Pemerintahan
Analisis Dampak Kebijakan Keuangan terhadap Pembangunan Ekonomi dalam Konteks Politik dan Pemerintahan,Keuangan,Politik dan Pemerintahan,Keuangan & Politik dan Pemerintahan
Persepsi dan Kepuasan Masyarakat terhadap Penggunaan Dana Publik dalam Politik dan Pemerintahan,Keuangan,Politik dan Pemerintahan,Keuangan & Politik dan Pemerintahan
Penilaian Efektivitas Program Keuangan dalam Meningkatkan Partisipasi dan Kesetaraan dalam Politik dan Pemerintahan,Keuangan,Politik dan Pemerintahan,Keuangan & Politik dan Pemerintahan
Tinjauan terhadap Keterkaitan Antara Keuangan dan Kebijakan Publik dalam Politik dan Pemerintahan,Keuangan,Politik dan Pemerintahan,Keuangan & Politik dan Pemerintahan
Evaluasi Efisiensi Pengelolaan Keuangan dalam Industri Transportasi dan Logistik,Keuangan,Transportasi dan Logistik,Keuangan & Transportasi dan Logistik
Analisis Dampak Kebijakan Keuangan terhadap Pembangunan Infrastruktur Transportasi dan Logistik,Keuangan,Transportasi dan Logistik,Keuangan & Transportasi dan Logistik
Tinjauan terhadap Pengeluaran dan Pendapatan dalam Bisnis Transportasi dan Logistik,Keuangan,Transportasi dan Logistik,Keuangan & Transportasi dan Logistik
Penilaian Peran Keuangan dalam Inovasi dan Modernisasi di Sektor Transportasi dan Logistik,Keuangan,Transportasi dan Logistik,Keuangan & Transportasi dan Logistik
Persepsi dan Preferensi Masyarakat terhadap Layanan Keuangan dalam Konteks Transportasi dan Logistik,Keuangan,Transportasi dan Logistik,Keuangan & Transportasi dan Logistik
Evaluasi Risiko dan Peluang Keuangan dalam Industri Transportasi dan Logistik,Keuangan,Transportasi dan Logistik,Keuangan & Transportasi dan Logistik
Evaluasi Pengelolaan Keuangan dalam Sektor Pertanian dan Perikanan,Keuangan,Pertanian dan Perikanan,Keuangan & Pertanian dan Perikanan
Tinjauan Kebutuhan Keuangan dalam Pengembangan Pertanian dan Perikanan,Keuangan,Pertanian dan Perikanan,Keuangan & Pertanian dan Perikanan
Analisis Dampak Kebijakan Keuangan terhadap Pertumbuhan dan Keberlanjutan Sektor Pertanian dan Perikanan,Keuangan,Pertanian dan Perikanan,Keuangan & Pertanian dan Perikanan
Penilaian Keterlibatan Lembaga Keuangan dalam Mendukung Keuangan Pertanian dan Perikanan,Keuangan,Pertanian dan Perikanan,Keuangan & Pertanian dan Perikanan
Evaluasi Kualitas Pelayanan Kesehatan dalam Industri Pariwisata,Pariwisata,Kesehatan,Pariwisata & Kesehatan
Tinjauan Persepsi dan Preferensi Wisatawan terhadap Kesehatan dan Keamanan dalam Pariwisata,Pariwisata,Kesehatan,Pariwisata & Kesehatan
Analisis Dampak Pariwisata terhadap Kesehatan Masyarakat Lokal,Pariwisata,Kesehatan,Pariwisata & Kesehatan
Penilaian Program Kesehatan dan Kebersihan di Destinasi Pariwisata,Pariwisata,Kesehatan,Pariwisata & Kesehatan
Penilaian Peran Pendidikan dalam Pengembangan Industri Pariwisata,Pariwisata,Pendidikan,Pariwisata & Pendidikan
Tinjauan Keinginan dan Preferensi Wisatawan terhadap Pendidikan Budaya Lokal dalam Konteks Pariwisata,Pariwisata,Pendidikan,Pariwisata & Pendidikan
Evaluasi Program Pendidikan di Destinasi Pariwisata untuk Meningkatkan Kesadaran Wisatawan akan Keberlanjutan Lingkungan,Pariwisata,Pendidikan,Pariwisata & Pendidikan
Persepsi Masyarakat terhadap Pendidikan dan Pelatihan di Sektor Pariwisata,Pariwisata,Pendidikan,Pariwisata & Pendidikan
Analisis Dampak Pariwisata terhadap Peningkatan Akses dan Kualitas Pendidikan di Komunitas Lokal,Pariwisata,Pendidikan,Pariwisata & Pendidikan
"Tinjauan tentang Pengetahuan Wisatawan terhadap Sejarah, Budaya, dan Warisan dalam Pariwisata dan Implikasinya pada Pendidikan",Pariwisata,Pendidikan,Pariwisata & Pendidikan
Evaluasi Efektivitas dan Kepatuhan Regulasi Hukum dalam Industri Pariwisata,Pariwisata,Hukum,Pariwisata & Hukum
Tinjauan tentang Perlindungan Hukum terhadap Hak-hak Wisatawan dalam Destinasi Pariwisata,Pariwisata,Hukum,Pariwisata & Hukum
Analisis Dampak Kebijakan Hukum terhadap Pengembangan dan Keberlanjutan Sektor Pariwisata,Pariwisata,Hukum,Pariwisata & Hukum
Penilaian Peraturan Hukum terkait Perlindungan Lingkungan dalam Konteks Pariwisata,Pariwisata,Hukum,Pariwisata & Hukum
Persepsi dan Kesadaran Masyarakat terhadap Aspek Hukum dalam Pariwisata dan Kepentingan Lokal,Pariwisata,Hukum,Pariwisata & Hukum
Evaluasi Penegakan Hukum terhadap Pelanggaran dan Kejahatan dalam Industri Pariwisata,Pariwisata,Hukum,Pariwisata & Hukum
Analisis Perilaku Pengeluaran Wisatawan dalam Industri Pariwisata,Pariwisata,Keuangan,Pariwisata & Keuangan
Penilaian Dampak Pariwisata terhadap Pertumbuhan Ekonomi dan Keuangan Lokal,Pariwisata,Keuangan,Pariwisata & Keuangan
Evaluasi Kebijakan Keuangan dan Pajak dalam Mendorong Investasi dan Pengembangan Pariwisata,Pariwisata,Keuangan,Pariwisata & Keuangan
Tinjauan tentang Peran Keuangan dalam Pengembangan Infrastruktur Pariwisata dan Peningkatan Daya Saing Destinasi,Pariwisata,Keuangan,Pariwisata & Keuangan
Preferensi dan Kepuasan Wisatawan terhadap Destinasi Pariwisata,Pariwisata,Pariwisata,Pariwisata & Pariwisata
Dampak Pariwisata terhadap Masyarakat Lokal dan Pembangunan Ekonomi,Pariwisata,Pariwisata,Pariwisata & Pariwisata
Persepsi Wisatawan terhadap Keberlanjutan Lingkungan dalam Industri Pariwisata,Pariwisata,Pariwisata,Pariwisata & Pariwisata
Penilaian Kualitas Layanan dan Infrastruktur Pariwisata di Destinasi Populer,Pariwisata,Pariwisata,Pariwisata & Pariwisata
Dampak Pariwisata terhadap Masyarakat Lokal dan Kesejahteraan Sosial,Pariwisata,Sosial dan Kemanusiaan,Pariwisata & Sosial dan Kemanusiaan
Persepsi dan Partisipasi Masyarakat dalam Pengembangan Pariwisata Berkelanjutan,Pariwisata,Sosial dan Kemanusiaan,Pariwisata & Sosial dan Kemanusiaan
Tinjauan tentang Etika dan Tanggung Jawab Sosial dalam Industri Pariwisata,Pariwisata,Sosial dan Kemanusiaan,Pariwisata & Sosial dan Kemanusiaan
Evaluasi Kontribusi Pariwisata terhadap Pemberdayaan Komunitas Lokal,Pariwisata,Sosial dan Kemanusiaan,Pariwisata & Sosial dan Kemanusiaan
Kesadaran dan Perilaku Wisatawan terhadap Praktik Pariwisata Berkelanjutan dan Pelestarian Lingkungan,Pariwisata,Lingkungan dan Konservasi,Pariwisata & Lingkungan dan Konservasi
Penilaian Dampak Pariwisata terhadap Keanekaragaman Hayati dan Konservasi Alam,Pariwisata,Lingkungan dan Konservasi,Pariwisata & Lingkungan dan Konservasi
Partisipasi Masyarakat dalam Pelestarian Lingkungan dalam Konteks Pariwisata,Pariwisata,Lingkungan dan Konservasi,Pariwisata & Lingkungan dan Konservasi
Pengelolaan Sampah dan Limbah dalam Destinasi Pariwisata untuk Keberlanjutan Lingkungan,Pariwisata,Lingkungan dan Konservasi,Pariwisata & Lingkungan dan Konservasi
Evaluasi Kebijakan dan Praktik Pelestarian Lingkungan dalam Industri Pariwisata,Pariwisata,Lingkungan dan Konservasi,Pariwisata & Lingkungan dan Konservasi
Penggunaan Teknologi Informasi dan Komunikasi oleh Wisatawan dalam Perencanaan Perjalanan,Pariwisata,Teknologi Informasi dan Komunikasi,Pariwisata & Teknologi Informasi dan Komunikasi
Pengaruh Media Sosial terhadap Persepsi dan Keputusan Wisatawan dalam Memilih Destinasi Pariwisata,Pariwisata,Teknologi Informasi dan Komunikasi,Pariwisata & Teknologi Informasi dan Komunikasi
Penggunaan Aplikasi Mobile dalam Meningkatkan Pengalaman Wisatawan di Destinasi Pariwisata,Pariwisata,Teknologi Informasi dan Komunikasi,Pariwisata & Teknologi Informasi dan Komunikasi
Evaluasi Efektivitas Promosi dan Pemasaran Pariwisata melalui Media Digital,Pariwisata,Teknologi Informasi dan Komunikasi,Pariwisata & Teknologi Informasi dan Komunikasi
Persepsi dan Pengalaman Wisatawan terkait Teknologi Informasi dan Komunikasi di Destinasi Pariwisata,Pariwisata,Teknologi Informasi dan Komunikasi,Pariwisata & Teknologi Informasi dan Komunikasi
Persepsi Wisatawan tentang Destinasi Pariwisata sebagai Tempat Olahraga dan Rekreasi,Pariwisata,Olahraga dan Rekreasi,Pariwisata & Olahraga dan Rekreasi
Pengaruh Aktivitas Olahraga terhadap Pengalaman Wisatawan di Destinasi Pariwisata,Pariwisata,Olahraga dan Rekreasi,Pariwisata & Olahraga dan Rekreasi
Evaluasi Fasilitas dan Infrastruktur Olahraga di Destinasi Pariwisata,Pariwisata,Olahraga dan Rekreasi,Pariwisata & Olahraga dan Rekreasi
Preferensi dan Kepuasan Wisatawan terkait Aktivitas Rekreasi di Destinasi Pariwisata,Pariwisata,Olahraga dan Rekreasi,Pariwisata & Olahraga dan Rekreasi
Peran Pariwisata dalam Meningkatkan Gaya Hidup Sehat melalui Aktivitas Olahraga dan Rekreasi,Pariwisata,Olahraga dan Rekreasi,Pariwisata & Olahraga dan Rekreasi
Dampak Wisata Olahraga dan Rekreasi terhadap Ekonomi Lokal di Destinasi Pariwisata,Pariwisata,Olahraga dan Rekreasi,Pariwisata & Olahraga dan Rekreasi
Persepsi Wisatawan terhadap Kesenian dan Budaya Lokal di Destinasi Pariwisata,Pariwisata,Seni dan Budaya,Pariwisata & Seni dan Budaya
Pengaruh Seni dan Budaya dalam Memilih Destinasi Pariwisata,Pariwisata,Seni dan Budaya,Pariwisata & Seni dan Budaya
Evaluasi Penawaran Seni dan Budaya di Destinasi Pariwisata,Pariwisata,Seni dan Budaya,Pariwisata & Seni dan Budaya
Preferensi Wisatawan terkait Pengalaman Seni dan Budaya di Destinasi Pariwisata,Pariwisata,Seni dan Budaya,Pariwisata & Seni dan Budaya
Dampak Pariwisata terhadap Pemertahanan Seni dan Budaya Lokal di Destinasi Pariwisata,Pariwisata,Seni dan Budaya,Pariwisata & Seni dan Budaya
Kontribusi Seni dan Budaya dalam Meningkatkan Daya Tarik Pariwisata,Pariwisata,Seni dan Budaya,Pariwisata & Seni dan Budaya
Persepsi Wisatawan terhadap Kearifan Lokal dan Tradisi di Destinasi Pariwisata,Pariwisata,Seni dan Budaya,Pariwisata & Seni dan Budaya
Peran Agama dan Kepercayaan dalam Pengalaman Pariwisata di Destinasi Spiritual,Pariwisata,Agama dan Kepercayaan,Pariwisata & Agama dan Kepercayaan
Preferensi Wisatawan terkait Destinasi Pariwisata Berbasis Agama atau Kepercayaan,Pariwisata,Agama dan Kepercayaan,Pariwisata & Agama dan Kepercayaan
Pengaruh Destinasi Pariwisata dengan Nilai Agama dan Kepercayaan terhadap Kepuasan Wisatawan,Pariwisata,Agama dan Kepercayaan,Pariwisata & Agama dan Kepercayaan
Dampak Wisata Religius dan Spiritual terhadap Pertumbuhan Ekonomi Destinasi Pariwisata,Pariwisata,Agama dan Kepercayaan,Pariwisata & Agama dan Kepercayaan
Persepsi Wisatawan terhadap Konservasi Budaya dan Keagamaan di Destinasi Pariwisata,Pariwisata,Agama dan Kepercayaan,Pariwisata & Agama dan Kepercayaan
Pendidikan dan Pengembangan Kesadaran Agama dan Kepercayaan dalam Konteks Pariwisata,Pariwisata,Agama dan Kepercayaan,Pariwisata & Agama dan Kepercayaan
Peran Industri Bisnis dalam Pengembangan Destinasi Pariwisata,Pariwisata,Bisnis dan Industri,Pariwisata & Bisnis dan Industri
Kepuasan Pengusaha terhadap Peluang Bisnis di Sektor Pariwisata,Pariwisata,Bisnis dan Industri,Pariwisata & Bisnis dan Industri
Pengaruh Infrastruktur Industri pada Daya Tarik Pariwisata Destinasi,Pariwisata,Bisnis dan Industri,Pariwisata & Bisnis dan Industri
Dampak Industri Pariwisata terhadap Pertumbuhan Ekonomi Lokal,Pariwisata,Bisnis dan Industri,Pariwisata & Bisnis dan Industri
Strategi Pemasaran Bisnis Pariwisata yang Berkelanjutan dan Berwawasan Lingkungan,Pariwisata,Bisnis dan Industri,Pariwisata & Bisnis dan Industri
Kemitraan Bisnis antara Industri dan Komunitas Lokal dalam Pengembangan Pariwisata,Pariwisata,Bisnis dan Industri,Pariwisata & Bisnis dan Industri
Peran Pemerintah dalam Pengembangan Industri Pariwisata,Pariwisata,Politik dan Pemerintahan,Pariwisata & Politik dan Pemerintahan
Kebijakan Politik dan Dampaknya terhadap Pariwisata Lokal,Pariwisata,Politik dan Pemerintahan,Pariwisata & Politik dan Pemerintahan
Persepsi Masyarakat tentang Efektivitas Kebijakan Pariwisata Pemerintah,Pariwisata,Politik dan Pemerintahan,Pariwisata & Politik dan Pemerintahan
Partisipasi Politik dan Pengaruhnya terhadap Pengelolaan Destinasi Pariwisata,Pariwisata,Politik dan Pemerintahan,Pariwisata & Politik dan Pemerintahan
Peran Politik dalam Pengaturan Infrastruktur Pariwisata,Pariwisata,Politik dan Pemerintahan,Pariwisata & Politik dan Pemerintahan
Transparansi dan Akuntabilitas Pemerintah dalam Pengembangan Pariwisata,Pariwisata,Politik dan Pemerintahan,Pariwisata & Politik dan Pemerintahan
Hubungan antara Pemerintahan Daerah dan Industri Pariwisata dalam Meningkatkan Daya Tarik Destinasi,Pariwisata,Politik dan Pemerintahan,Pariwisata & Politik dan Pemerintahan
Evaluasi Kualitas Transportasi dan Logistik dalam Pengembangan Pariwisata,Pariwisata,Transportasi dan Logistik,Pariwisata & Transportasi dan Logistik
Preferensi Transportasi yang Digunakan oleh Wisatawan saat Berlibur,Pariwisata,Transportasi dan Logistik,Pariwisata & Transportasi dan Logistik
Penilaian Keefektifan Sistem Transportasi dalam Meningkatkan Aksesibilitas Destinasi Pariwisata,Pariwisata,Transportasi dan Logistik,Pariwisata & Transportasi dan Logistik
Persepsi Masyarakat terhadap Ketersediaan dan Kualitas Infrastruktur Transportasi di Destinasi Pariwisata,Pariwisata,Transportasi dan Logistik,Pariwisata & Transportasi dan Logistik
Dampak Keterhubungan Transportasi dan Logistik terhadap Pengembangan Pariwisata Lokal,Pariwisata,Transportasi dan Logistik,Pariwisata & Transportasi dan Logistik
Persepsi Wisatawan terhadap Pengalaman Pariwisata Berbasis Pertanian dan Perikanan,Pariwisata,Pertanian dan Perikanan,Pariwisata & Pertanian dan Perikanan
Kontribusi Pertanian dan Perikanan dalam Pengembangan Pariwisata Lokal,Pariwisata,Pertanian dan Perikanan,Pariwisata & Pertanian dan Perikanan
Preferensi dan Keinginan Wisatawan terkait Produk Pertanian dan Perikanan dalam Konteks Pariwisata,Pariwisata,Pertanian dan Perikanan,Pariwisata & Pertanian dan Perikanan
Dampak Pariwisata terhadap Pertanian dan Perikanan dalam Aspek Ekonomi dan Sosial,Pariwisata,Pertanian dan Perikanan,Pariwisata & Pertanian dan Perikanan
Keterlibatan Masyarakat Lokal dalam Pengembangan Pariwisata Berbasis Pertanian dan Perikanan,Pariwisata,Pertanian dan Perikanan,Pariwisata & Pertanian dan Perikanan
Kualitas Produk Pertanian dan Perikanan sebagai Daya Tarik Pariwisata: Tinjauan Perspektif Wisatawan,Pariwisata,Pertanian dan Perikanan,Pariwisata & Pertanian dan Perikanan
Persepsi dan Kesadaran Masyarakat terhadap Kesehatan dalam Konteks Sosial dan Kemanusiaan,Sosial dan Kemanusiaan,Kesehatan,Sosial dan Kemanusiaan & Kesehatan
Dampak Sosial dan Kemanusiaan terhadap Kesehatan Masyarakat,Sosial dan Kemanusiaan,Kesehatan,Sosial dan Kemanusiaan & Kesehatan
Aksesibilitas Layanan Kesehatan dalam Pendekatan Sosial dan Kemanusiaan,Sosial dan Kemanusiaan,Kesehatan,Sosial dan Kemanusiaan & Kesehatan
Peran Organisasi Sosial dan Kemanusiaan dalam Meningkatkan Kesehatan Masyarakat,Sosial dan Kemanusiaan,Kesehatan,Sosial dan Kemanusiaan & Kesehatan
Peran Pendidikan dalam Mempromosikan Kesetaraan Sosial dan Kemanusiaan,Sosial dan Kemanusiaan,Pendidikan,Sosial dan Kemanusiaan & Pendidikan
Dampak Program Pendidikan Terhadap Peningkatan Kesadaran Sosial dan Kemanusiaan,Sosial dan Kemanusiaan,Pendidikan,Sosial dan Kemanusiaan & Pendidikan
Persepsi Masyarakat tentang Pendidikan Inklusif dan Sosial dalam Konteks Kemanusiaan,Sosial dan Kemanusiaan,Pendidikan,Sosial dan Kemanusiaan & Pendidikan
Tantangan dan Peluang Pendidikan dalam Membangun Masyarakat yang Lebih Adil dan Manusia yang Berdaya,Sosial dan Kemanusiaan,Pendidikan,Sosial dan Kemanusiaan & Pendidikan
Keterlibatan Komunitas dalam Pendidikan Sosial dan Kemanusiaan,Sosial dan Kemanusiaan,Pendidikan,Sosial dan Kemanusiaan & Pendidikan
Inovasi Pendidikan untuk Mendorong Partisipasi Aktif dalam Pembangunan Sosial dan Kemanusiaan,Sosial dan Kemanusiaan,Pendidikan,Sosial dan Kemanusiaan & Pendidikan
Persepsi Masyarakat tentang Peran Hukum dalam Mempromosikan Keadilan Sosial dan Kemanusiaan,Sosial dan Kemanusiaan,Hukum,Sosial dan Kemanusiaan & Hukum
Dampak Sistem Hukum terhadap Perlindungan Hak Asasi Manusia dan Kesetaraan Sosial,Sosial dan Kemanusiaan,Hukum,Sosial dan Kemanusiaan & Hukum
Persepsi Masyarakat tentang Perlindungan Hak Asasi Manusia dalam Konteks Sosial dan Hukum,Sosial dan Kemanusiaan,Hukum,Sosial dan Kemanusiaan & Hukum
Pemahaman dan Kesadaran Masyarakat terhadap Isu Keadilan Sosial dalam Sistem Hukum,Sosial dan Kemanusiaan,Hukum,Sosial dan Kemanusiaan & Hukum
Dampak Sosial dan Hukum terhadap Penanganan Kasus Pelanggaran Hak Asasi Manusia dalam Masyarakat,Sosial dan Kemanusiaan,Hukum,Sosial dan Kemanusiaan & Hukum
Persepsi Masyarakat tentang Ketimpangan Ekonomi dan Dampaknya terhadap Kesenjangan Sosial,Sosial dan Kemanusiaan,Keuangan,Sosial dan Kemanusiaan & Keuangan
berkeruyuk konsekutif memberangsang kraniotomi prekositas mekanisasi terjerahak,Sosial dan Kemanusiaan,Keuangan,Sosial dan Kemanusiaan & Keuangan
Persepsi Masyarakat tentang Pengelolaan Keuangan Rumah Tangga dan Kesejahteraan Sosial,Sosial dan Kemanusiaan,Keuangan,Sosial dan Kemanusiaan & Keuangan
Dampak Sosial dan Kemanusiaan Investasi dan Donasi dalam Konteks Keuangan,Sosial dan Kemanusiaan,Keuangan,Sosial dan Kemanusiaan & Keuangan
Persepsi Masyarakat tentang Dampak Pariwisata terhadap Kesejahteraan Sosial dan Kemanusiaan di Destinasi Wisata,Sosial dan Kemanusiaan,Pariwisata,Sosial dan Kemanusiaan & Pariwisata
Peran Pariwisata dalam Meningkatkan Kesadaran Sosial dan Kemanusiaan di Komunitas Lokal,Sosial dan Kemanusiaan,Pariwisata,Sosial dan Kemanusiaan & Pariwisata
Dampak Pariwisata terhadap Kebudayaan dan Kehidupan Sosial Masyarakat Lokal di Destinasi Wisata,Sosial dan Kemanusiaan,Pariwisata,Sosial dan Kemanusiaan & Pariwisata
Pengelolaan Pariwisata yang Berkelanjutan untuk Mempromosikan Kesejahteraan Sosial dan Kemanusiaan di Destinasi Wisata,Sosial dan Kemanusiaan,Pariwisata,Sosial dan Kemanusiaan & Pariwisata
Dukungan dan Partisipasi Masyarakat dalam Kegiatan Sosial dan Kemanusiaan di Destinasi Pariwisata,Sosial dan Kemanusiaan,Pariwisata,Sosial dan Kemanusiaan & Pariwisata
